{
  "schema_version": 1,
  "pack": "maincity",
  "texture_delivery": "standalone_png",
  "base_url": "./",
  "assets": [
    {
      "id": "mc.building.barracks.v1",
      "kind": "sprite",
      "slot_key": "barracks",
      "display_size": {
        "w": 220,
        "h": 180
      },
      "anchor": {
        "x": 110,
        "y": 180
      },
      "anchor_unit": "pixels",
      "variants": [
        {
          "scale": 1,
          "path": "barracks-1x.png"
        },
        {
          "scale": 2,
          "path": "barracks-2x.png"
        }
      ]
    }
  ]
}
