{"schema_version":1,"pack":"maincity","texture_delivery":"standalone_png","base_url":"/assets/art/v1/","assets":[{"id":"res.icon.wood.v1","kind":"icon","display_size":{"w":32,"h":32},"anchor":{"x":16,"y":16},"anchor_unit":"pixels","variants":[{"scale":1,"path":"textures/1x/icons/wood.png"},{"scale":2,"path":"textures/2x/icons/wood.png"}]},{"id":"res.icon.iron.v1","kind":"icon","display_size":{"w":32,"h":32},"anchor":{"x":16,"y":16},"anchor_unit":"pixels","variants":[{"scale":1,"path":"textures/1x/icons/iron.png"},{"scale":2,"path":"textures/2x/icons/iron.png"}]},{"id":"res.icon.stone.v1","kind":"icon","display_size":{"w":32,"h":32},"anchor":{"x":16,"y":16},"anchor_unit":"pixels","variants":[{"scale":1,"path":"textures/1x/icons/stone.png"},{"scale":2,"path":"textures/2x/icons/stone.png"}]}]}
